Company name,Name,Review,Overall Company Rating
Google,Abhilash N,"One of the fantastic office i had experienced as an employee.I cannot forget the wonderful memories that google gave me.Absolutely people will love with google in its ambience,there security,food,work environment and everything thats in there office.Google is just means happiness and liberty.",4.7
Google,Arjun Korrapati,Google Review is the worst in terms of managing customer issues against the reviews. Please try to give the make the google review concept much better. Current concept does not allow a fake customer reviews to delete the review from google …More,4.7
Google,Ashish kumar,It's like heaven. #Dream,4.7
Google,krishna kachawar,"I have one suggestion for Google map ,there show some error in showing when traveling through flyover map can't understand from where we are going ( upper road or down road) . For this when solution is that Google voice instructer if says …More",4.7
Google,Arunkumar Duraiswamy,My best experience ever in my life. The environment motivates you to work for them.  Awesome work culture. Longing to be there always.,4.7
Google,Uma Mahesh,Good place to hang out and work here,4.7
Google,vinit meshram,"Amazing environment,  amazing campus,amazing people ,just loved it",4.7
Google,Saikumar Kumar,GOOGLE:A place where  every individuals wishes to work at and be a part of it. As a employee of Google client I have really enjoyed my 2 years of journey and learned alot in knowledge and technical skills. GOOGLE is the only orginzation …More,4.7
Google,GARAPATI ANUSHA,"Awesomeee place to work and learning the new things what happening with the Google. How they treat and taking care of employees was excellent and the njymnt is also there in work life, but Iam unlucky from  this july,iam leaving this my loving place",4.7
Google,Youth Princess,"Evry thing is gud office, location ,work, facilities. Every thing in google is clean and green. Google take many precautions to safe guard its employees. It not only protects its employess but also encourage them to explore in there intrested field.",4.7
Google,Anchal Ganotra,Good spacious placeCorporate offices …More,4.7
Google,SANDEEP YADAV Konda,Best Place I ever worked.I Love it because1) Free Food to all it's employees …More,4.7
Google,JIMMY ALLAN MUMMERT,Univision good morning India and Bangladesh ready to fly to USA blog no badges working USA everything looking back home now thank you over there with you guys you see my now p my eye is everything you fly to USA now no game it's over. White b La Kaiser Permanente employees offline now  by now,4.7
Google,sachin nelwade,It is just awesome inside ...,4.7
Google,Shabber Ali Khan,Best place to start your career with amazing colleagues and management. You get to work on many futuristic projects and understand the world through the eyes of Google.,4.7
Google,Madhura Bhanu,Good but security shouldn't allow bikers without helmet and most of the employees block the road by standing at the gate for autos and no bus stop at Google just stand and run to catch the bus,4.7
Google,Hema Sai Charan Kothamasu,It's one of the destination for every software engineer wants to visit in their lifetime. I got an opportunity to visit the Google Hyderabad office on behalf of GDG devfest 2018 codelab session. I spent one of the best and beautiful time at …More,4.7
Google,Manish Agarwal,Awesome place to work…. I always heard about Google’s office and at last got chance to visit Google office in Hyderabad in November 2017. I found this place is neat and clean. I found security persons are very helpful.,4.7
Google,Fazeel Usmani,"I visited this Google office on 29th June for a top Neighbours meetup. It was an impeccable experience to traverse all around the campus. There was a slide from first floor to ground, a huge canteen where a wide variety of cuisines are …More",4.7
Google,Teja Pratap,They have a slide in their office! Melody chocolates are everywhere freely available. Food is free. And everything's so colourful!,4.7
Google,BHARATH CHAUHAN,Nice place for Googlers. And other companies who are located in the same location. Basketball court is available for Googlers only.  Can walk along side of building for small walk in the morning n Eve if u r login falls according to. …More,4.7
Google,nagaraj nagaraj,Good Atmosphere for Employees we have enjoyed food is so delicious  number of varity dishes fruits. 👍,4.7
Google,Venkat Mudiyala,"Hyderabad office, the largest campus in India, acts as the technology development centre operating from a leased premise with a total head count of 6,500 employees. The company, in 2015, had also acquired a 7.2 acre-plot of land in the IT …More",4.7
Google,Akkaldevi Vivek,"I love this place, world ruling software development company, many branches over world, office's architecture is so good to see and visit, but never miss an opportunity if you get job over here...",4.7
Google,Prabhu Puli,Best environment for working and gaining experience in market. The food provided was damn good even we can maintain gym diet.,4.7
Google,Suresh Nelli,Provide good service,4.7
Google,Swathi Kolupula,"This place is at kondapur near Jayabheri towers. This office has good, well equipped infrastructure facilities. Good place to work. It is one of the best companies in the world.",4.7
Google,BK Gajendra,All you can expect from this company as it is one of the best corporate to work for. Always the company is giving more importance to his employees... Dream for Engineers,4.7
Google,Nagaraj N,It's Google office in Kondapur.NOTE :Parking is not available outside …More,4.7
Google,Akhil Kalita,Very very effective।।।।,4.7
Google,Penumarthi HariKrishna,Amazing place to visit.,4.7
Google,krishna ved,The staff and dr have been nice and professional. Very good care and experience speaksShalini has been of great help all through …More,4.7
Google,naveen kumar,One of the best place to visit in your life time...a spacious office floors with lot of companies to give support for Google products.... really loved the Google food and a lot of snacks also available,4.7
Google,RAHUL LOKANATHAN. R,Worst Interview process and the HR wasted nearly 2 months to answer the follow up mail,4.7
Google,faizan uddin,"Google is the best place for work...very friendly atmosphere and supportive colleagues....free food(breakfast,lunch,dinner),snacks and juices...Atmosphere and infrastructure is brilliant.Security service is also good.Working in Google was such a wonderful experience.",4.7
Google,Darshan kotaputla,"The infrastructure is good looking and it has mainly 3 blocks with separate parkings and it as it as it's own basketball, volleyball courts.",4.7
Google,Susama lenka,Company environment is good to work. All team mates are supporting. I am very glad to be part of laalsa.,4.7
Google,Mohd touheed Touheed,New products and offer,4.7
Google,TONTI AMRANO,I Love Google.I like everything in Google.Google is Dream of my life. …More,4.7
Google,Saptak Mohanta,"One of the most gorgeous Google offices, spread over 3 connected buildings. Wide spread of food from different cuisines, although not the healthiest choices.",4.7
Google,Vishalya Siriperambudur,"Now a days in omega B building Google facilities serving wrost food to their employees by Adding Soda in rice, curries and pickles smells different. Very often employees were sick and no action on this even after several complaints.",4.7
Google,Cheryl Hung,"Omega A is a fun and Googly place to work at, and the cafe food is pretty great. The contractor's building (Omega B) is distinctly less nice.",4.7
Google,Mustafa Golam,Five star facilities . you can slide from 1sr floor the entrance. Food is exceptionally good. The day I went they didn't have Hyderabadi Biriyani.,4.7
Google,Sai Teja naidu Kanakam,Nice place for work and food provide by Google is top notch and interior in the office is super and excellent.the have good security and always recommend Google,4.7
Google,B Swamy,Its in peacefully residencialcolony surrounds trees and nice walking place is there to walk staff also very good for bday parties  to Friends it's a perfect place .,4.7
Google,Purna Yeluri,"Best place.. Found Great Work Life Balance Options., Awesome Cafeteria. Fun & Work well balanced.. Been there for Google Cloud Conference..",4.7
Google,NITIN SARVANE,Ossum place Hydrabaad for tourism and one of the best food is Chikan biryani I really enjoy this place you make also visit 3-4 days for  vacation,4.7
Google,Naga Venkata Raju Ramanujam,"One of the top most MNC's. I am glad to work here. Superb technology teams, friendly atmosphere and facilities.",4.7
Google,Aaryan Sharma,I loved the campus. Google is a dream company of any engineer thatswhy for me too as well. The campus is just awesome.,4.7
Google,Sampara Venkatagangaraju,Excellent atmosphere.Had break fast.Very good,4.7
Google,MA NI,"Nice building or apartment with extradionary constructure, I don't know the interior design but I saw besides on road looking great in kotgaguda /madhapur city at rs 20",4.7
Google,Dr. Ashok Patnaik,Located near Kondapur area.It has become a land mark for people who travell to Kondapur from Hitech city. You get local auto transport facility to reach here and you need prior appointment to enter in the building.,4.7
Google,Jayant Dubey,Situated in overcrowded part. Traffic in front of the building is a nightmare. Hoping new business spreads out over Hyderabad and ORR instead on cramming Hitec and Gachibowli.,4.7
Google,Vishnu Poreddy,"I went as a visitor accompanied by an employee, floor space decoration and facilities are awesome. It's a dream office for anyone with all the benefits.",4.7
Google,Shiva Pothuganti,Awesome place to Work... Food Drinks Work environment extremely Awesome.Every Person wants to Work in Google client locationFinally Am in to it... …More,4.7
Google,sandeep raj,Excellent place to work here....as i am working with google(under vendor) we get many facilities here as the permanent google employees get....and having good eco friendly environment...and a very good place to really work... Security is tight but friendly too...,4.7
Google,Amjad Hussain,I can visit here to recover my Google account.? Or to ask for help.?,4.7
Google,Joy Basu,"It is located at one of the core location of Cyberabad surrounded by global standard office places, Hotels, supermarket, bud stop, Railway connectivity, Auto stop & so on. More over Google Office itself a landmark of the location.",4.7
Google,Shanmukha Bhargav Gajula,It's a good looking architecture. Just loved it.,4.7
Google,Michael Jarosz,"They are not doing a good job of keeping Google Maps updated even in their own city. So much info, even for basic government services like driver license office or police station, is missing or outdated.",4.7
Google,Nazrul Hasan,"Awesome Environment and the Best place to work, loved all my days I have worked here, Beautiful Interior and a top level facilities.",4.7
Google,murala santhosh,It's nice work environment to work and taste of food for the employees is also good along with can facility and many more,4.7
Google,NEHA CHAUHAN,Good office place,4.7
Google,Naga Raju,I attended for search console event on June 16' 2018. Who are working in Google they are very lucky. Good IT Campus and cafeteria.,4.7
Google,Lucky Rose,Nice environment and good structure of the office ..but didn't liked food,4.7
Google,Nisha Singh,If you work here it's just heaven you can have all kinds of fast food over here and everything is near in terms of enjoyment,4.7
Google,Navakanth Prabhas,"Ilove the company,it is Awesome company with good infrastructure, excellent environment to work , employees r treated very well ,  parities,gym facility,no work pressure from boss, good place to work",4.7
Google,Shalabh Negi,"Great place to work. Awesome environment, food and people. Made many friends out there.",4.7
Google,amer khan,"Infrastructure is good apart from that if I write more about Google on Google maps it looks weird,free food,higher packages,and the culture is awesome of this place",4.7
Google,sai kumar,"DivyaSree Omega Hyderabad is a executive business centre offer fully furnished serviced office space with all facilities, prime location business address, virtual office for rent, meeting rooms, HD Video conference room in Hyderabad.",4.7
Google,G.Venkata Krishna Venki,Well maintained and organised. You will not feel like leaving once you enter ;)Environment is great and interior is awesome!,4.7
Google,Nakul Barar,"It's by far the best place to work in the country !!! The work culture is amazing, there is free food, free snacks, 24x7 cab service etc. Love this place !!!",4.7
Google,Puvvada Neha,As I have not spend even 1day also -so I don't know Much about this and from outside we can see that over all construction was not bad..,4.7
Google,Monica Kolapur,His it's My working place but I love De most cool environment n youngest people u seen n also passonaite people over Der towards work n carrer,4.7
Google,Niyasali V,Poor customer support.,4.7
Google,Abhiroop Roychoudhury,The place is awesome ... A perfect place for a person who wants to go home happily after work.. I love working here..,4.7
Google,mounika vemuganti,Absolutely the best place to work! Nice infrastructure and parking facilities. Positive atmosphere.,4.7
Google,Vicky,Google office client location which is in Divyasree Omega building hi-tech city. Best place to work here. I have worked here for 2 year's.,4.7
Google,angule dazo,I have been always amazed by the kind of ambience google creates for its employees. And there is food! you can't choose what to eat and what to not.,4.7
Google,Pawan Agarwal,Happy Birthday to GOOGLEMillions Of People Greetings! …More,4.7
Google,Akshar “Alphabeatz” Patel,Who wouldn't love Google. I just live the epic it feels to look at Google's logo. I see my dream workspace right shimmering in front of me.,4.7
Google,Rishabh Mishra,"It is amazing place to work, has cricket nets and basketball court for practice. There are many projects which are outsourced.",4.7
Google,Purandara Vegesna,Best place to work. Office looks very good and cafeteria is awesome. Love google,4.7
Google,Nithin Narayanan,Even though I don't work here - there is always this good feeling while passing this office or standing here and staring at the logo.Well nevermind - One day!,4.7
Google,Prasun Bheri,Awesome work place.. all the facilities that an employee needs are available.. perfect place to focus on work..,4.7
Google,Mohan Sai Rohit Challa,I loved this place because I had my favorite logo Google. This might sound strange but it's true as I love Google a lot and is my dream.,4.7
Google,Gokul Velusamy,"No words, Simply awesome...",4.7
Google,Mahabir Mishra,"Easily accesible location and this Google office is at Divyashree Omega Campus,Hitech City.Office interioir is Awsm ad u also got so many fascilities in this office if you are a Google Employee.",4.7
Google,Abdul Jabbar,"The story started when i got a like to a reply from Google on my Twitter account, that was the the day i started dreaming of Google.when i visited Hyderabad, i requested my elder cousin to take me there and i clicked some pictures from outside and hopefully i will do the same from inside too!",4.7
Google,Hrishikesh Sinkar,Amazing place to work at. The place offers amazing amenities. The place has an amazing work ambience. The cafeterias here are great.,4.7
Google,rajani nadella,"Its a dream place, eco friendly, awesome place. Good security measures and very good canteen. Hyderabad's pride place.",4.7
Google,Sita Negi,I want to know that what kind of employees u r hiring .There is a employee called syed fareeda begum .she is troubling my life she is non stop calling my husband try to apart us that kind of employees u hiring I request u to fire this girl because she ruin my life I hv one year daughter too,4.7
Google,Sifar,Wonderful environment to work with Google . Good facilities and lots of memories with Google in many years. Hope one day will patch up with Google again ;),4.7
Google,Mudassir Shaikh,"One of the top company of innovation and new technologies and new products,loved to work in this Google office If I get a chance,I cannot describe it in words ,even words are less for this company,because I love Google...",4.7
Google,nitin r reddy,"The dream place for everyone. The place is cozy and welcoming, attractive and never boring. you could sleep and work here.",4.7
Google,Jafar pasha,"Google LLC is an American multinational technology company that specializes in Internet-related services and products, which include online advertising technologies, search engine, cloud computing, software, and hardware. Google began in …More",4.7
Google,saka Hanisha,"Highly professional area with good parking lot, spacious and greenery maintained around. It is highly restricted place for outsiders and is crowded at prime times.",4.7
Google,Ravi Kanth Nishtala,Office is in highly accessible location. Entry and exit access though is very poorly managed. No place for pedestrians to walk.,4.7
Google,Ravinder Rao,Excellent customer service. Looking forward for the same kind of support during  the After Sales Service as well.,4.7
Google,Shivanand Gaitonde,Very informal but Business like atmosphere.Facilities are excellent and much above average.,4.7
Google,rama varma,"I have a flat in Guruprasad Soc. Lokhsndvala complex, Andheri (W). It is a nice welknown place in Mumbai (400 053). About other places it is suggested to get in touch with the residents of the places shown above.",4.7
Google,JUSTIN THOMAS,TANK YOUGIVING ME A CUSTOMIZED GOOGLE SEARCH BAR FOR BIRTH DAY …More,4.7
Google,Gayathri Sree hari raju,Thanks google 💕,4.7
Google,Nikhil Patil,This is the official google headquarters located in Mumbai you can visit or take a tour of this is and only if you have appointment from the HR or your know person is working there,4.7
Google,Shahrukh Shikalgar,"Had great time here, Enjoy lot with people here and food was amazing here. Work environment was totally cool",4.7
Google,hemanth kumar Ubbani,It's very great work location I have been there for 8 month I love this place,4.7
Google,Rathan kalluri,"What to say about Google .. Even a new born knows about this awesome ""alphabet"" company. And you never find such a cool place to work ...anywhere in the world..",4.7
Google,Mirza Irfan Ali Baig,I loved this place having peacful mood all the time enjoying and every one will love once they visit,4.7
Google,Priyanka Ambat,A best place with different companies having office space their they work on improving Google product s,4.7
Google,Nikhil Ponny,The first Google building in Hyderabad. This consist of three different blocks of different sections. Good office environment,4.7
Google,Vishwanath Varma,Building looks great from outside. Who wouldn't like to work with Google. Always been a dream to work in Google.,4.7
Google,I R (Babbu),"I visited near by Google office not in inside, it's look awesome, I always try work for Google in real time,  I love Google by heart, a pleasure to work in Google,  great place to work for.",4.7
Google,Ram Nagesh,Great ambiance,4.7
Google,Pranav Kumar,Had a great experience at the Google Hyderabad branch.The staff and other personnels were very Friendly.Totally the work Environment is awesome in the Premises.,4.7
Google,Deep Chakraborty,Building is awesome with superb interior and nice food inside office and awesome work culture.. .. Makes it best place for work,4.7
Google,Ashitha Kamble,Good place to work at! However little hectic to get there because of the traffic infornt of its gate!,4.7
Google,Vishal Chauhan,Well office is nice and yeah good to have job here which provide more service,4.7
Google,Likhi Bharadwaj,"Nice office, I've experienced a lot here but I hate the thing that the management is not that good here, even I've worked good i was removed from company just bcoz of the process criticality",4.7
Google,Shiva Manish Karepe,Company serves needs of its employees but the food served in Omega C Block is not upto the mark. Most people faced issue with white rice.,4.7
Google,Nitin Kulkarni,All the facilities are available. Good connectivity. Easy to notice in heavy traffic. One of the most important landmark in kondapur.,4.7
Google,Ashish Singh,Good office and take care of their employees very well,4.7
Google,Manish Kumar,"Awesome place to work with awesome people, always ready for new ideas & innovations.",4.7
Google,Srihari Melukota,Very high expectations about global IT Leader...but office atmosphere is like ordinary Indian IT Offices....,4.7
Google,Manikanta Korata,Loved This place...good company to work...food and drinks are awesome.. Really FUN at work kind of company...,4.7
Google,rajini teja,Best of the best ....there is another corporate world inside the office,4.7
Google,Shiv Kumar,"Work environment is excellent,  food and pantry is good.  They provide very good food.  Security is very high",4.7
Google,Laxman Reddy,Completely a different world experience visiting google. Must visit place in Hyderabad.,4.7
Google,Heena Khan,Place to work along with enjoyment.Best security providers for there employees.Anyone one wanna in google go for it😄😄😄,4.7
Google,Rana Jayant,A great place with truelly supportive people. They really helped in understanding things better and planning for expansion.,4.7
Google,Saleem Shaik,"Six storey building complex, provide best food to their employees includes gym, free food",4.7
Google,E kranti private Limted,Digital Indian Informations Technology Website development Director Rahul Kumar Singh from Google E kranti Pvt LTD,4.7
Google,Naren Chandra,"So called the heaven on earth ,the best place to work with all the eminities and best work culture.  Words can't describe this place   .",4.7
Google,Sree Divya Akula,"Amazing place, awesome work culture,  hi-tech facilities, birth place of many creative ideas, colour full infrastructure, a festive place especially for foodies",4.7
Google,Rohit Bomma,Great place to work They Provide all kinda facilities to the employees,4.7
Google,Mithila Krishnadas,Such a great place to visit for geeks,4.7
Google,Tufazzal Hossen,"Oh Very Nice Google Office Hydarabad India From Shefali Medical Hall Kalibari Bazaar Muktagachha Mymensingh Dr,MD.Tufazzal Hossen( Diploma Medical  Assistance)",4.7
Google,Chaitanya Vankadaru,Lovely place. Employee or guest; it doesn't matter who you are. You'll just love the place.,4.7
Google,Abhishek Chopde,Excellent place to work. There's a slide from first floor with office.. OMG,4.7
Google,A raju Kothamasu,It's one of the biggest office in hyderabad and everywhere in the world.There are many companies under Google.And security is very strict and no one is allowed without id card.,4.7
Google,nagendra praveen,It is really stunning,4.7
Google,Rajesh Bujji,Nice campus,4.7
Google,Kapil Anand,Really had a wonderful time in Google Publisher Meet. Got to learn really good insights which will enhance work efficiency.,4.7
Google,Shanthi Priya,Space for setting up corporate office. Good plan and facilities like parking etc.,4.7
Google,AVK ENTERTAINMENTS,This is used to get direction easily travel best app for everyone.,4.7
Google,Sourav Kumar Nanda,"what an awesome place to work with.. inside office is soo soothing, cant describe in words",4.7
Google,Jonah Jagadeshan,"Great, fun place to work with many amenities for it's employees including spa facilities.",4.7
Google,Mehant Kammakomati,Had been invited for tech intern connect program. Great place to work,4.7
Google,Syed Salman,Best place to work,4.7
Google,Adrita Guha,This is the best place to work inThe culture is amazing! And facilities are mind blowing,4.7
Google,Nitesh Misra,"Google Hyderabad office. Food is absolutely the best in Hyderabad, so if you know a Googler ask them to invite you for a meal",4.7
Google,John Chanou,Google Omega A has a street view which is Phenomenal. It will be great if there is street view whole India atleast whole Andhra Pradesh. If possible,4.7
Google,puja kunche,One of the best places to work in Hyderabad. Made many friends here and learned a lot. Thank you Google.,4.7
Google,Rajesh Narikenabilli,Superb work environment... Employee satisfaction is the biggest positive factor..,4.7
Google,Madhuri Gangaraju,Best offices to work with...stress free environment...great work culture... awesome working experience...👍,4.7
Google,Rahul Prasad,Situated in the heart of Hyderabad's IT hub is Google's campus. Good infrastructure with good recreational activities.,4.7
Google,K Rama Krishna,"Fine here every person what to-do job here but to get job in google not so easy, even people think at least  get job outsourcing once",4.7
Google,Amal S. Kuriakose,"I simply have no words to describe this place, the food, the people in it, everything! It's simply awesome! <3",4.7
Google,Mounika C,Good work place to start as a fresher.  I worked for 2 years and the infrastructure is superb,4.7
Google,Suraj Shikalgar,Its amazing experience and Google means Google,4.7
Google,Pranay Gandra,"Google a great place learn more, create more ,contribute more",4.7
Google,Himanshu Raj,Nice infrastructure...,4.7
Google,Sai Kiran,Good place to start career & a place to grow ourself..  only a talent & intrest can get you a job at this place,4.7
Google,Pallabi Das,Nice environment .They are saving 80% of water. Food inside google is too delicious 😋,4.7
Google,Karthik Proag,Amazing Google office in the heart of the city. A great ambiance indeed and a very refreshing workplace.,4.7
Google,Chinnari Valurouthu,Fantastic,4.7
Google,Abdul Ghani,"Loved it. Totally awesome experience. High security, great interiors, Hospitality. I loved the food 😋",4.7
Google,Asifa Mariyam,Best place to work I am in love this place best security in Google and one more good food,4.7
